{
  "id": "MSG-5e0196ea5ac3",
  "from_agent": "researcher-2",
  "to_agent": "brainstorm",
  "swarm_name": "swarm_dev",
  "type": "handoff",
  "subject": "RESEARCHER-2 Gaps Analysis: Critical Findings for Innovation Review",
  "body": "Work handoff from researcher-2 to brainstorm.\n\n**Work Completed:** Comprehensive gaps and missing features analysis completed. KEY CRITICAL GAPS: (1) Task Tool Delegation BROKEN - does NOT spawn real agents, (2) Work Ledger NOT CONNECTED - 1065 lines orphaned, (3) Agent Mailbox NOT CONNECTED - 1005 lines orphaned, (4) Review Workflow NOT ENFORCED. MISSING FEATURES: Agent Memory Continuity, Intelligent Task Decomposition, Swarm Brain Server. QUICK WINS: Schedule recover_orphaned_work(), Wire Work Ledger to Task detection, Fix singleton thread safety.\n\n**Current State:** Full analysis documented in workspace/research/parallel_research_gaps.md with 12 gaps identified and prioritized\n\n**Next Steps:**\n- Review findings for innovation opportunities\n- Prioritize which gaps enable the most improvements\n- Consider how auto-spawn depends on GAP-2 (Work Ledger)\n- Design integration strategy for orphaned components\n\n**Blockers:**\n- GAP-1 (Task Tool) requires architectural redesign\n- GAP-2 (Work Ledger) blocks auto-spawn functionality",
  "payload": {},
  "priority": 3,
  "created_at": "2026-01-04T00:53:21.667898",
  "expires_at": null,
  "status": "unread",
  "read_at": null,
  "completed_at": null,
  "reply_to": null,
  "thread_id": null,
  "context": {
    "work_completed": "Comprehensive gaps and missing features analysis completed. KEY CRITICAL GAPS: (1) Task Tool Delegation BROKEN - does NOT spawn real agents, (2) Work Ledger NOT CONNECTED - 1065 lines orphaned, (3) Agent Mailbox NOT CONNECTED - 1005 lines orphaned, (4) Review Workflow NOT ENFORCED. MISSING FEATURES: Agent Memory Continuity, Intelligent Task Decomposition, Swarm Brain Server. QUICK WINS: Schedule recover_orphaned_work(), Wire Work Ledger to Task detection, Fix singleton thread safety.",
    "files_modified": [
      "workspace/research/parallel_research_gaps.md"
    ],
    "files_created": [],
    "current_state": "Full analysis documented in workspace/research/parallel_research_gaps.md with 12 gaps identified and prioritized",
    "state_file": null,
    "next_steps": [
      "Review findings for innovation opportunities",
      "Prioritize which gaps enable the most improvements",
      "Consider how auto-spawn depends on GAP-2 (Work Ledger)",
      "Design integration strategy for orphaned components"
    ],
    "blockers": [
      "GAP-1 (Task Tool) requires architectural redesign",
      "GAP-2 (Work Ledger) blocks auto-spawn functionality"
    ],
    "dependencies": [],
    "related_escalations": [],
    "job_id": null,
    "notes": ""
  },
  "attachments": [
    "workspace/research/parallel_research_gaps.md"
  ],
  "tags": [
    "handoff"
  ]
}